{
  "id": "code_review_issues_fix_20260610",
  "title": "代码审查问题修复（第三轮）",
  "description": "修复第三轮代码审查中发现的 5 项严重问题，包括随机数溢出、Mock 延迟同步阻塞、JS 全局锁网络 IO 瓶颈、OAuth2 CSRF 隐患与配置更新竞态条件。",
  "status": "done",
  "created_at": "2026-06-10",
  "priority": "high",
  "tags": ["bugfix", "refactor", "security", "concurrency"]
}
