{
  "id": "auth_framework_oauth2_20260312",
  "title": "Authentication Framework & OAuth 2.0 Support",
  "description": "Introduces a unified authentication framework for HTTP requests, implementing OAuth 2.0 flows (Authorization Code, Client Credentials, etc.) and refreshing mechanisms.",
  "status": "done",
  "created_at": "2026-03-12",
  "priority": "high",
  "tags": ["feature", "auth", "oauth2", "security"]
}